{
	"$schema": "http://json-schema.org/draft-04/schema#",
	"type": "object",
	"additionalProperties": false,
	"properties": {
		"$schema": {
			"description": "JSON Schema",
			"type": "string"
		},
		"BaseScale": {
			"description": "Base scale multiplier for everything Everyone does. This includes the size of objects Everyone creates (remote players, note dots, etc), distances between objects, and the size of text.",
			"type": "number",
			"default": 1,
			"minimum": 0
		},
		"LocalPlayer": {
			"description": "These conditions are used to determine which game object is considered the local player. It's this object that determines where each player's model is positioned. By default, Everyone tries to find the player using a few preconfigured conditions (player tag, main camera, etc), so in many cases you won't need to configure this at all.",
			"$ref": "#/definitions/ObjectSearch"
		},
		"MainCamera": {
			"description": "These conditions are used to determine which game object is considered the main camera. Everyone needs to know which camera is the main one, so it can make objects face that camera when needed, and to hide objects that are too close to the camera. By default, Everyone uses Camera.main, which works in the majority of games. But in some games, you might need to configure this manually.",
			"$ref": "#/definitions/ObjectSearch"
		},
		"Origin": {
			"description": "These conditions are used to determine which game objects are used as reference points for the player's position / rotation. If this is defined, positions will be relative to the origin object closest to each player. This is useful when the absolute coordinate system isn't enough. For instance in games where the scene gets centered around the player (known as \"floating origin\"), or games that have random layouts (but still have nonrandom \"rooms\"). The vast majority of games don't need this.",
			"$ref": "#/definitions/ObjectSearch"
		},
		"Text": {
			"type": "object",
			"description": "Determines how text is rendered. Affects the text from player name labels and the text from player notes.",
			"additionalProperties": false,
			"properties": {
				"TextScale": {
					"type": "number",
					"description": "Scale multiplier for all text rendered by Everyone. Note that this multiplies together with the BaseScale property. That means BaseScale=2 and TextScale=3 gives you a total text scale multiplier of 2*3=6.",
					"default": 1,
					"minimum": 0
				}
			}
		},
		"RemotePlayer": {
			"type": "object",
			"description": "Adjustments for how the player models are presented.",
			"additionalProperties": false,
			"properties": {
				"PositionOffset": {
					"type": "string",
					"description": "Local position offset to apply to the model. Useful if the object you're using as LocalPlayer doesn't quite track the correct position. Format: 'x,y,z'. Example: '0.1,0,1.32'.",
					"default": "0,0,0"
				},
				"EulerAnglesOffset": {
					"type": "string",
					"description": "Local rotation offset to apply to the model. Useful if the object you're using as LocalPlayer doesn't quite track the correct rotation. Format: 'x,y,z'. Example: '0.1,0,1.32'.",
					"default": "0,0,0"
				}
			}
		},
		"Note": {
			"type": "object",
			"description": "Adjustments for how notes are presented.",
			"additionalProperties": false,
			"properties": {
				"PositionOffset": {
					"type": "string",
					"description": "Local position offset to apply to the model. Format: 'x,y,z'. Example: '0.1,0,1.32'.",
					"default": "0,0,0"
				},
				"EulerAnglesOffset": {
					"type": "string",
					"description": "Local rotation offset to apply to the model. Format: 'x,y,z'. Example: '0.1,0,1.32'.",
					"default": "0,0,0"
				}
			}
		},
		"Rendering": {
			"type": "object",
			"description": "Adjustments for how Everyone renders things.",
			"additionalProperties": false,
			"properties": {
				"ShaderName": {
					"type": "string",
					"description": "Name of a shader to use for the remote player objects. This must be a shader that's already included in the game. Ideally an unlit shader that supports one of these properties: _Color, _BaseColor, _MainTex or _BaseMap. By default Everyone uses its own custom unlit shader, which may not always work."
				},
				"RenderQueue": {
					"type": "number",
					"description": "Render queue to use for Everyone materials. Make it higher if Everyone stuff is rendering behind other things, or if you see effects like ambient occlusion rendering on top of the players.",
					"minimum": 0,
					"maximum": 5000,
					"default": 4000
				}
			}
		}
	},
	"definitions": {
		"SearchQuery": {
			"type": "object",
			"additionalProperties": false,
			"properties": {
				"Component": {
					"type": "string",
					"description": "Name of a Component / MonoBehaviour, including the namespace. Most games don't use a namespace for their custom scripts, but many do, so make sure you're using the correct full name. Example: 'UnityEngine.CharacterController'"
				},
				"Tag": {
					"type": "string",
					"description": "Object tag to search for. Common tags are Player and MainCamera (which Everyone already uses by default to find the main camera and player object)."
				},
				"ObjectName": {
					"type": "string",
					"description": "Case insensitive game object name to search for."
				},
				"ChildPath": {
					"type": "string",
					"description": "After a base object is found using any combination of Component, Tag or ObjectName, this path is used to find a more specific child. This is useful in cases where the game's player object represents the entire character body, and you want the player model to be specifically in the character's head, for instance. Format: 'ChildA/ChildB/ChildC'."
				}
			}
		},
		"ObjectSearch": {
			"type": "object",
			"additionalProperties": false,
			"properties": {
				"Include": {
					"type": "array",
					"description": "Conditions to apply when searching for this object. The order of this list is important: Everyone will test each item in order, and will use the first one that successfully finds an object. Most games only need a single item in this list. Adding more items is useful for games where the objects we want to track change depending on what's happening in the game.",
					"items": {
						"$ref": "#/definitions/SearchQuery"
					}
				},
				"Exclude": {
					"type": "array",
					"description": "If an object matches any of the conditions in this list, it will be excluded from the results of the \"Include\" conditions. Order doesn't matter here, all conditions are tested.",
					"items": {
						"$ref": "#/definitions/SearchQuery"
					}
				}
			}
		}
	}
}
