{
	"$schema": "https://raw.githubusercontent.com/Raicuparta/rai-pal-db/refs/heads/main/config-db/0/schema/everyone-config-schema.json",
	"LocalPlayer": {
		"Include": [
			{
				"Component": "Ynglet.YngletPlayer"
			}
		]
	},
	"MainCamera": {
		"Include": [
			{
				"Component": "Ynglet.CameraControllerBase2D"
			}
		]
	},
	"BaseScale": 5,
	"Text": {
		"TextScale": 3
	},
	"RemotePlayer": {
		"EulerAnglesOffset": "0,180,90"
	}
}
