{
	"$schema": "https://raw.githubusercontent.com/Raicuparta/rai-pal-db/refs/heads/main/config-db/0/schema/everyone-config-schema.json",
	"BaseScale": 2,
	"LocalPlayer": {
		"Include": [
			{
				"ObjectName": "Player0",
				"ChildPath": "PlayerSprite/HeadPosition"
			}
		]
	},
	"Text": {
		"TextScale": 1.5
	},
	"RemotePlayer": {
		"EulerAnglesOffset": "0,130,0"
	}
}
